{
  "$schema": "http://json-schema.org/draft-07/schema#",
  "$id": "https://github.com/procoders/superpowers-v/schemas/pre-eval-record.schema.json",
  "title": "Compound V pre-eval record",
  "description": "Canonical, write-once control-plane record written by the pre-eval scoring engine (A3) to docs/superpowers/pre-eval/<pre_eval_id>.json BEFORE any run dir exists (AC-2). `status: PRE_EVAL_DONE` is a RECORD field, NOT a state.json phase (AC-7/CR2-8) — there is no state.json at prediction time. `decision` carries one of three tiers (FASTPATH_ELIGIBLE / SCOPED_PIPELINE / FULL_PIPELINE, v3.0 spec §A1). Iron-Invariant #4 AS AMENDED (spec §A4): the score OFFERS by default and auto-routes only inside the DIRECT auto-route class, whose membership is decided by mechanically checkable predicates and never by model judgement; every other tier still requires a human offer and acceptance. Enforcement fields are deterministic (taxonomy/localization/override logic), never model magnitude (Iron-Invariant #1). C1's fast-path cross-artifact binding (AC-13) verifies pre_eval_id / decision / taxonomy_digest / localization-digest match across this record, the manifest, and the localization artifact.\n\nDIGEST CONVENTION (CR5-6/CR5-7, single-sourced in compound-v-taxonomy.py, documented in docs/superpowers/architecture/pre-eval-config.md): the record's own `digest` = 'sha256:' + sha256(canonical_json(record MINUS the `digest` field)), where canonical_json = json.dumps(obj, sort_keys=True, separators=(',',':'), ensure_ascii=False, allow_nan=False). `taxonomy_digest` is a DISTINCT convention: 'sha256:' + sha256(RAW taxonomy-snapshot bytes) — a content address of the immutable snapshot, not a re-serialization.",
  "type": "object",
  "additionalProperties": false,
  "required": [
    "pre_eval_id",
    "request_slug",
    "ts",
    "status",
    "taxonomy_version",
    "difficulty",
    "impact",
    "tiers_signalled",
    "localization",
    "override_fired",
    "decision",
    "min_sample_status"
  ],
  "allOf": [
    {
      "if": {
        "properties": { "decision": { "not": { "const": "FULL_PIPELINE" } } },
        "required": ["decision"]
      },
      "then": {
        "description": "ANY record that is not FULL_PIPELINE — FASTPATH_ELIGIBLE or SCOPED_PIPELINE — MUST pin a real, non-null taxonomy snapshot + its content-address. The condition is stated NEGATIVELY (`decision != FULL_PIPELINE`) on purpose: keyed on `const: FASTPATH_ELIGIBLE` it silently stopped applying the moment a third tier existed, and a SCOPED record with a null taxonomy would have validated — the exact fail-open this check exists to prevent. No proportionate tier is reachable without the sensitive-path + content-pattern protections: `_has_safety_coverage` in compound-v-preeval.py routes an absent, malformed or unreadable taxonomy to an unconditional FULL_PIPELINE, so this conditional is the machine-checked restatement of an engine invariant rather than a second policy. taxonomy_ref/taxonomy_digest are required and strictly typed here.",
        "required": ["taxonomy_ref", "taxonomy_digest"],
        "properties": {
          "taxonomy_ref": { "type": "string", "minLength": 1 },
          "taxonomy_digest": { "type": "string", "pattern": "^sha256:[0-9a-f]{64}$" }
        }
      }
    },
    {
      "if": {
        "properties": { "override_fired": { "type": "integer" } },
        "required": ["override_fired"]
      },
      "then": {
        "description": "ANY FIRED OVERRIDE FORCES FULL (see also the taxonomy conditional above, which is keyed the same negative way) (v3.0 spec §A1). A record whose override_fired is a real row id MUST carry decision=FULL_PIPELINE. Machine-checked here so a record that pairs a hard override with a proportionate tier cannot exist even if a future producer regresses.",
        "properties": { "decision": { "const": "FULL_PIPELINE" } },
        "required": ["decision"]
      }
    },
    {
      "if": {
        "properties": { "decision": { "const": "FASTPATH_ELIGIBLE" } },
        "required": ["decision", "tier"]
      },
      "then": {
        "description": "Tier agreement: `tier` is a readability alias for `decision`, never an independent claim. The triage gate prefers `tier`, so a disagreement would let a record be exempted as a tier its own decision refuses.",
        "properties": { "tier": { "const": "DIRECT" } }
      }
    },
    {
      "if": {
        "properties": { "decision": { "const": "SCOPED_PIPELINE" } },
        "required": ["decision", "tier"]
      },
      "then": {
        "description": "Tier agreement - see the FASTPATH_ELIGIBLE case above.",
        "properties": { "tier": { "const": "SCOPED" } }
      }
    },
    {
      "if": {
        "properties": { "decision": { "const": "FULL_PIPELINE" } },
        "required": ["decision", "tier"]
      },
      "then": {
        "description": "Tier agreement - see the FASTPATH_ELIGIBLE case above. This is the case that matters most: a FULL record wearing `tier: DIRECT` would be exempted by the triage gate as if it were the auto-route class.",
        "properties": { "tier": { "const": "FULL" } }
      }
    }
  ],
  "properties": {
    "pre_eval_id": {
      "type": "string",
      "description": "Write-once join key, minted before localization (CR5-10). Convention: 'YYYY-MM-DDThhmmssZ-<slug>-<nonce>'. The stream key for triage-outcomes and the binding key across every fast-path artifact. Independent of run_id (which does not exist yet).",
      "pattern": "^[0-9]{4}-[0-9]{2}-[0-9]{2}T[0-9]{6}Z-[A-Za-z0-9._-]+-[A-Za-z0-9]+$"
    },
    "run_id": {
      "type": ["string", "null"],
      "description": "The run this pre-eval later bound to, or null while unbound (a declined/full-pipeline request may never become a run). Set only via the `bind` triage event once the run dir is created; NEVER present at PRE_EVAL_DONE time."
    },
    "request_slug": {
      "type": "string",
      "description": "Slug derived from the request text (not the not-yet-existing plan). Human-readable; part of pre_eval_id."
    },
    "ts": {
      "type": "string",
      "description": "ISO-8601 UTC timestamp the record was written."
    },
    "status": {
      "type": "string",
      "const": "PRE_EVAL_DONE",
      "description": "Record-status field (prose-only lifecycle token; AC-7/CR2-8). NOT a state.json phase — no run dir exists at prediction time."
    },
    "taxonomy_version": {
      "type": ["string", "integer", "null"],
      "description": "The `version` of the taxonomy snapshot used. Human-readable; the machine binding is `taxonomy_digest`. NULL in the absent-taxonomy FULL_PIPELINE case (there is no taxonomy to version)."
    },
    "taxonomy_ref": {
      "type": ["string", "null"],
      "description": "Repo-relative, normalized, no-'..' path to the IMMUTABLE taxonomy snapshot the score was computed against (pre-run, under docs/superpowers/pre-eval/<pre_eval_id>.taxonomy-snapshot.yaml). A committed regular file (never an escaping symlink). Copied into the run preserving this digest when a fast-path materializes (CR2-6/CR4-2). NULLABLE for the absent-taxonomy case (see taxonomy_digest); the first `allOf` conditional (`if decision != FULL_PIPELINE`) makes it a required, non-null, non-empty string on any proportionate-tier record — FASTPATH_ELIGIBLE and SCOPED_PIPELINE alike."
    },
    "taxonomy_digest": {
      "type": ["string", "null"],
      "pattern": "^sha256:[0-9a-f]{64}$",
      "description": "'sha256:'+sha256(RAW snapshot bytes) of taxonomy_ref. On a FASTPATH_ELIGIBLE record it is required and MUST equal the manifest's taxonomy_digest (AC-13). ABSENT-TAXONOMY CASE (spec §2 missing-data table + Iron-Invariant #5): when the taxonomy file/snapshot is absent, malformed, or unavailable there is no snapshot to reference and no bytes to digest, so the engine STILL writes the record (and appends the `predicted` event) with decision=FULL_PIPELINE and `taxonomy_ref: null` / `taxonomy_digest: null` / `taxonomy_version: null`. Such a record validates precisely because these three fields are nullable when decision != FASTPATH_ELIGIBLE; the first `allOf` conditional forbids that null-taxonomy state from ever carrying a PROPORTIONATE decision — it is keyed `decision != FULL_PIPELINE`, so it binds SCOPED_PIPELINE exactly as it binds FASTPATH_ELIGIBLE. A3/C1/M1 MUST treat the null-taxonomy record as an unconditional FULL_PIPELINE. (`pattern` applies only when the value is a string, so null passes.)"
    },
    "difficulty": { "$ref": "#/$defs/axis" },
    "impact": { "$ref": "#/$defs/axis" },
    "tiers_signalled": {
      "type": "array",
      "items": { "type": "string", "enum": ["T1", "T2", "T3", "churn", "localization"] },
      "description": "Which evidence tiers produced a signal (audit trail + `confidence` evidence). NEVER a gating number."
    },
    "localization": { "$ref": "#/$defs/localization" },
    "override_fired": {
      "type": ["integer", "null"],
      "description": "The Layer-A hard-override row id (1-7, spec §2 rows 1-6 plus the appended advisor-hot row 7) that forced FULL_PIPELINE, or null if none fired. A non-null value REQUIRES decision=FULL_PIPELINE, and the second `allOf` conditional above enforces it mechanically. This is not redundancy with the bands: override #4 (semantic-vs-path disagreement) records the GENUINE low/low bands beside override_fired=4, so a consumer that re-derived the tier from `difficulty`+`impact` would grant DIRECT — and with it the auto-route class — to a record whose own audit trail says a hard override fired. Read `decision`, never the bands."
    },
    "decision": {
      "type": "string",
      "enum": ["FASTPATH_ELIGIBLE", "SCOPED_PIPELINE", "FULL_PIPELINE"],
      "description": "The triage outcome, one of THREE proportionate tiers (v3.0 spec §A1). FASTPATH_ELIGIBLE = tier DIRECT (implement in place, run the floor, commit on the branch — no manifest, no run dir); SCOPED_PIPELINE = tier SCOPED (manifest, run dir, scope gate, floor, one combined SPEC+QUALITY review; recon and the three pre-flights skipped); FULL_PIPELINE = tier FULL (the whole pipeline). The value is produced by the 3x3 difficulty×impact matrix INSIDE compound-v-preeval.py's `score`, and consumers MUST branch on all three values explicitly — a `== FASTPATH_ELIGIBLE ? A : B` reader is a two-value reader of a three-value enum. Iron-Invariant #4 AS AMENDED (spec §A4): the score OFFERS by default and auto-routes only inside the DIRECT auto-route class, whose membership is decided by mechanically checkable predicates and never by model judgement; every other tier still requires a human offer and acceptance. Any override / unknown axis / missing-or-malformed taxonomy / token-cap overrun ⇒ FULL_PIPELINE (fail-closed), and a non-null `override_fired` ALWAYS pairs with FULL_PIPELINE regardless of the recorded bands."
    },
    "tier": {
      "type": "string",
      "enum": ["DIRECT", "SCOPED", "FULL"],
      "description": "OPTIONAL, and REDUNDANT BY CONSTRUCTION: the manifest-vocabulary token for `decision` (FASTPATH_ELIGIBLE=DIRECT, SCOPED_PIPELINE=SCOPED, FULL_PIPELINE=FULL - compound-v-preeval.py's DECISION_TO_TIER). The triage gate in `hooks/epic-goal-stop.sh` PREFERS this field over `decision` when it is present, so an unconstrained `tier` would be a second, higher-priority source of truth for a safety-relevant classification: a record could say `decision: FULL_PIPELINE` and `tier: DIRECT` and be exempted as DIRECT. The three tier-agreement conditionals in the top-level `allOf` therefore PIN it to `decision`, which makes the hook's preferred branch provably identical to its fallback rather than a way around it. Carry it for human readability; never as an independent claim. `decision` remains the authority.",
      "$comment": "Pinned to `decision` by the tier-agreement conditionals in the top-level allOf."
    },
    "session_id": {
      "type": ["string", "null"],
      "minLength": 1,
      "description": "The harness session this record was written in - the value on the `Stop` hook's stdin payload, compared EXACTLY by the triage gate in `hooks/epic-goal-stop.sh`. Written by `/v:triage`, the only component that knows it: the scoring engine never sees a session, so a record produced by `compound-v-preeval.py` alone omits this field. ABSENT OR NULL MEANS THE RECORD BINDS NO SESSION AND THEREFORE COVERS NOTHING - the gate's exact-match test cannot succeed against an empty value, which is the fail-closed direction. Never required: requiring it would invalidate every record the engine writes outside a triage command.",
      "$comment": "minLength applies only to the string form; null passes. The empty string is rejected because it asserts a session binding that can never match."
    },
    "base_commit": {
      "type": ["string", "null"],
      "pattern": "^[0-9a-f]{7,40}$",
      "description": "The commit HEAD pointed at when this record was written. RECORDED, NOT DECISIVE: `hooks/epic-goal-stop.sh` reads it and deliberately derives NO freshness rule from it, because HEAD legitimately advances mid-session - any commit moves it, including /v:triage's own commit of this very record - so a mismatch is not evidence that the record is stale. The field exists so a human or a later audit can say which tree the classification was made against. Do not add a staleness check keyed on it without evidence that a mismatch actually correlates with a bad decision. (`pattern` applies only when the value is a string, so null passes.)"
    },
    "declared_paths": {
      "type": "array",
      "uniqueItems": true,
      "items": { "$ref": "#/$defs/declared_path" },
      "description": "The repo-relative paths this record's classification actually covers - the field that turns the triage gate from an existence check into a COVERAGE check. `hooks/epic-goal-stop.sh` exempts a changed path only when the record is for the same session AND the path lies inside this set; without it, one triage of 'change the README' would exempt an unrelated later edit to that hook itself. COVERAGE IS THE THREE-WAY MATCH THAT HOOK IMPLEMENTS, and it is deliberately narrow: an exact string match, a DIRECTORY PREFIX only when the entry ends in `/`, or a glob only when the entry contains `*`. A bare `scripts` does NOT cover `scripts/app.py` - write `scripts/` or `scripts/**`. Widening a declared set by accident is the one direction this must not fail in, which is also why the item constraints reject what the hook would otherwise silently drop. Written by `/v:triage`; usually the localization's `resolved_paths`, but kept a separate field because a record may legitimately declare a broader set than triage resolved."
    },
    "min_sample_status": {
      "type": "string",
      "enum": ["insufficient", "calibrated"],
      "description": "Whether Tier-2 had >= min_sample_count calibrated FAST-PATH-TAKEN outcomes. `insufficient` (the launch default, no data) means Tier-2 is escalation-only (Iron-Invariant #3 counterfactual guard)."
    },
    "confidence": {
      "type": ["number", "string", "null"],
      "description": "Evidence-only confidence label (signalled tiers + localization confidence). Shown as EVIDENCE, never a gating number (spec §2). Optional."
    },
    "digest": {
      "type": "string",
      "pattern": "^sha256:[0-9a-f]{64}$",
      "description": "Self-integrity digest of THIS record: 'sha256:'+sha256(canonical_json(record without `digest`)). Optional; when present, downstream verifies it with compound-v-taxonomy.record_digest(record, exclude_field='digest'). IT COVERS EVERY OTHER FIELD, the Feature-C binding (`session_id`, `base_commit`, `declared_paths`, `tier`) included. A producer that attaches the binding AFTER building the record ships one whose digest no longer verifies, and does so silently because this field is optional and only checked when present. Pass the binding to compound-v-preeval.py `build_record(..., binding={...})`, which folds it in before the digest is taken."
    }
  },
  "$defs": {
    "declared_path": {
      "type": "string",
      "minLength": 1,
      "pattern": "^[^/\u0000-\u001f][^\u0000-\u001f]*$",
      "not": { "pattern": "(^|/)\\.\\.(/|$)" },
      "description": "One entry in `declared_paths`: a repo-relative path, a directory prefix (trailing `/`), or a glob (containing `*`). CONSTRAINED TO MATCH WHAT THE CONSUMER CAN ACTUALLY READ. `hooks/epic-goal-stop.sh` serializes candidates as `tierU+001Frun_idU+001Fpath` lines and DROPS any entry containing U+001F, LF or CR, because a re-escaped path would no longer equal the path git reports. Dropping narrows the declared set, which is the safe direction for the hook but silent for the producer - so this pattern rejects every C0 control character here, where the producer still learns. A leading `/` is rejected because paths are repo-relative and git never reports an absolute one, so such an entry could only ever match nothing while looking like coverage. `..` segments are rejected because an entry that escapes the repo cannot describe a changed path, and normalizing it here would create a second path semantics to keep in sync with the gate's."
    },
    "band": {
      "type": "string",
      "enum": ["low", "medium", "high", "unknown"],
      "description": "A deterministic band — never a raw magnitude (Iron-Invariant #1). `unknown` forces FULL_PIPELINE via Layer-A override #6."
    },
    "axis": {
      "type": "object",
      "additionalProperties": false,
      "required": ["band"],
      "properties": {
        "band": { "$ref": "#/$defs/band" },
        "display": {
          "type": ["integer", "null"],
          "description": "Derived 1-10 DISPLAY label (low→1-3, med→4-6, high→7-10); band-midpoint or per-tier max. Computed AFTER the decision — never the gate (spec §2)."
        }
      }
    },
    "localization": {
      "type": "object",
      "description": "The bounded read-only localization result. When A1 writes it as the standalone committed artifact docs/superpowers/pre-eval/<pre_eval_id>.localization.json, that file has THIS shape and its own canonical-JSON `digest` (record_digest, exclude_field='digest'); that localization-digest is the value bound across manifest+record+artifact (AC-13).",
      "additionalProperties": false,
      "required": ["resolved_paths", "fan_out", "flags", "confidence"],
      "properties": {
        "resolved_paths": {
          "type": "array",
          "items": { "type": "string" },
          "description": "Repo-relative paths the request resolves to. Fast-path REQUIRES exactly one literal normalized path; resolved_paths[0] MUST equal the manifest's sole write_allowed literal (AC-13)."
        },
        "fan_out": {
          "type": "integer",
          "minimum": 0,
          "description": "How many distinct sites/paths the change touches. Fast-path requires fan_out <= pre_eval.fan_out_threshold (Layer-B)."
        },
        "flags": {
          "type": "array",
          "items": { "type": "string" },
          "description": "Semantic flags from the shared taxonomy classify() (e.g. sensitive_path, content:shared_token, content:a11y, content:feature_flag). Any override-triggering flag forces FULL_PIPELINE."
        },
        "confidence": {
          "type": "string",
          "enum": ["exact", "ambiguous", "failed"],
          "description": "Localization confidence. `ambiguous`/`failed` ⇒ Layer-A override #1 ⇒ FULL_PIPELINE (Iron-Invariant #2: no `low` without exact localization)."
        }
      }
    }
  }
}
